source_table,uploaded_filename,worksheet_name,title,description,note
A-3,2025_FACTS_Table_A-3.xlsx,FACTS Table A-3,"Table A-3: Applicants to U.S. MD-Granting Medical Schools by State of Legal Residence, Academic Years 2016-2017 through 2025-2026",The table below displays the numbers of applicants by state of legal residence from 2016-2017 through 2025-2026. Please email datarequest@aamc.org if you need further assistance or have additional inquiries.,"Note: Each academic year includes applicants and matriculants who applied to enter medical school in the fall of the given year. For example, academic year 2025-2026 represents the applicants and matriculants who applied to enter medical school during the fall of 2025."
A-4,2025_FACTS_Table_A-4.xlsx,FACTS Table A-4,"Table A-4: Matriculants to U.S. MD-Granting Medical Schools by State of Legal Residence, Academic Years 2016-2017 through 2025-2026",The table below displays the numbers of matriculants by state of legal residence from 2016-2017 through 2025-2026. Please email datarequest@aamc.org if you need further assistance or have additional inquiries.,"Note: Each academic year includes applicants and matriculants who applied to enter medical school in the fall of the given year. For example, academic year 2025-2026 represents the applicants and matriculants who applied to enter medical school during the fall of 2025."
A-5,2025_FACTS_Table_A-5.xlsx,FACTS Table A-5,"Table A-5: Applicants to U.S. MD-Granting Medical Schools by In or Out-of-State Matriculation Status, Academic Year 2025-2026",The table below displays the numbers of applicants in 2025-2026 by state of legal residence and their in-state or out-of-state matriculation status. Please email datarequest@aamc.org if you need further assistance or have additional inquiries.,"Note: Each academic year includes applicants and matriculants who applied to enter medical school in the fall of the given year. For example, academic year 2025-2026 represents the applicants and matriculants who applied to enter medical school during the fall of 2025."
A-7.1,2025_FACTS_Table_A-7.1.xlsx,FACTS Table A-7.1,"Table A-7.1: Applicants, First-Time Applicants, Acceptees, and Matriculants to U.S. MD-Granting Medical Schools by Gender, Academic Years 2006-2007 through 2015-2016","The table below displays applicants, first-time applicants, acceptees, and matriculants from 2006-2007 through 2015-2016. Please email datarequest@aamc.org if you need further assistance or have additional inquiries.","Note: Applicants, acceptees, and matriculants who declined to report gender are not reflected. Therefore, the sum of the Men and Women counts may not equal the total. In 2016, the methodology for calculating first-time applicants was updated from any applicant who had not applied in the past nine years to any applicant who had not applied since 1973, the earliest year for which there is AMCAS data. The counts for all years in this table reflect the new methodology. Due to the updated methodology, tables published prior to 2016 may display different first-time applicant counts. Each academic year includes applicants and matriculants who applied to enter medical school in the fall of the given year. For example, academic year 2025-2026 represents the applicants and matriculants who applied to enter medical school during the fall of 2025."
A-7.2,2025_FACTS_Table_A-7.2.xlsx,FACTS Table A-7.2,"Table A-7.2: Applicants, First-Time Applicants, Acceptees, and Matriculants to U.S. MD-Granting Medical Schools by Gender, Academic Years 2016-2017 through 2025-2026","The table below displays applicants, first-time applicants, acceptees, and matriculants from 2016-2017 through 2025-2026. Please email datarequest@aamc.org if you need further assistance or have additional inquiries.","Notes: Applicants, acceptees, and matriculants who declined to report gender are not reflected. Therefore, the sum of the Women, Men, and Another Gender Identity counts may not equal the total. In 2016-2017, the methodology for calculating first-time applicants was updated from any applicant who had not applied in the past nine years to any applicant who had not applied since 1973, the earliest year for which there is AMCAS data. The counts for all years in this table reflect the new methodology. Due to the updated methodology, tables published prior to 2016 may display different first-time applicant counts. In 2023-2024, the ""Another Gender Identity"" response option was added to the gender question on the AMCAS application. Each academic year includes applicants and matriculants who applied to enter medical school in the fall of the given year. For example, academic year 2025-2026 represents the applicants and matriculants who applied to enter medical school during the fall of 2025."
